{
  "schema_version": "anibench.optimizer-protocol-input.v2",
  "optimizer_id": "illustrative-protocol-design-sandbox",
  "base_protocol": {},
  "objectives": [
    {
      "objective_id": "retained-events",
      "family_path": "extensive.retained_participant_events",
      "envelope_bound": "minimum",
      "direction": "maximize"
    },
    {
      "objective_id": "longitudinal-density",
      "family_path": "longitudinal.retained_participant_events",
      "envelope_bound": "minimum",
      "direction": "maximize"
    }
  ],
  "resource_constraints": [
    {
      "resource_id": "direct-cost",
      "unit": "USD_2026",
      "base_amount": 1000000,
      "maximum_amount": 2000000,
      "as_of": "2026-07-12",
      "source_object_sha256": "sha256:8298029694374d6e3e787288303b62d08098c6fe114265e133ae86a023e65693",
      "source_locator": "illustrative:budget:envelope"
    }
  ],
  "mutations": [
    {
      "mutation_id": "expand-outcome-schedule",
      "description": "Double the outcome schedule from four to eight linked events.",
      "protocol_operations": [
        {
          "op": "replace",
          "path": "/measurement_geometry/participant_event_schedules/1/events_per_participant",
          "value": {"state": "exact", "value": 8}
        },
        {
          "op": "replace",
          "path": "/measurement_geometry/participant_event_schedules/1/temporal_offsets",
          "value": [0, 15, 30, 45, 60, 75, 90, 105]
        }
      ],
      "resource_deltas": [
        {
          "resource_id": "direct-cost",
          "unit": "USD_2026",
          "amount": 500000,
          "as_of": "2026-07-12",
          "source_object_sha256": "sha256:8298029694374d6e3e787288303b62d08098c6fe114265e133ae86a023e65693",
          "source_locator": "illustrative:cost-model:expanded-schedule"
        }
      ],
      "source_object_sha256": "sha256:8298029694374d6e3e787288303b62d08098c6fe114265e133ae86a023e65693",
      "source_locator": "illustrative:amendment:expanded-schedule"
    }
  ],
  "maximum_mutations_per_candidate": 1,
  "candidate_limit": 2
}
